{
  "$schema": "http://json-schema.org/draft-07/schema#",
  "$id": "tools/agent/schemas/changelog.schema.json",
  "title": "Noctune Changelog Snippet",
  "description": "A changelog entry snippet written to pending_changes/ by the runner after commit. Parsed by the release job to build CHANGELOG.md.",
  "type": "object",
  "required": ["type", "area", "summary"],
  "properties": {
    "type": {
      "type": "string",
      "enum": ["feat", "fix", "perf", "refactor", "test", "docs", "chore", "content", "hud"],
      "description": "Conventional commit type — release job parses this for CHANGELOG grouping"
    },
    "area": {
      "type": "string",
      "description": "Top-level src/ directory name, or agent/pipeline/meta"
    },
    "summary": {
      "type": "string",
      "description": "One-line imperative summary of the change"
    },
    "details": {
      "type": "string",
      "description": "Multi-line details for the CHANGELOG entry"
    },
    "task": {
      "type": "string",
      "description": "Queue entry id that produced this changelog snippet"
    }
  },
  "additionalProperties": false
}
